{
    "title": "Quiz comandos básicos POSTGRESQL",
    "type": "quiz",
    "description": "Responda o quiz assinalando as alternativas corretas",
    "expectation": "Compreender comandos simples para operar no banco de dados postgressql, o aluno deve ser capaz de compreender comandos simples para realizar operações CRUD em um banco de dados postgresql",
    "questions": [
        {
            "material": "Bruno estava operando no banco de dados da empresa, quando se deparou com uma situação em que precisava cadastrar um usuário manualmente. Os usuários deste sistema contém 3 campos simples: Email e Senha. Bruno precisava cadastrar manualmente um usuário com as seguintes credenciais: jorge@gmail.com, senha1234",
            "question": "Qual alternativa demonstra como inserir os valores mostrados na tabela de usuário?",
            "type": "options",
            "options": [
                "SELECT * FROM usuarios;",
                "INSERT usuarios jorge@gmail.com, senha1234",
                "INSERT INTO usuarios (email, senha) VALUES ('jorge@gmail.com', 'senha1234')"
            ],
            "explanation": "Para um banco de dados PostgreSQL utilizamos o comando 'INSERT INTO' para inserir usuários.",
            "answer": 2
        },
        {
            "question": "Qual comando Bruno deve usar para vizualizar todos os usuários?",
            "type": "options",
            "options": [
                "SELECT * FROM usuarios",
                "DELETE FROM usuarios",
                "BEGIN TRAN"
            ],
            "explanation": "Para um banco de dados PostgreSQL utilizamos o comando 'SELECT {campos}' para inserir usuários.",
            "answer": 0
        },
        {
            "question": "Como deletar todas as linhas de uma tabela 'tarefas'?",
            "type": "text",
            "explanation": "Para deletar todas as linhas de uma tabela utilizamos o comando DELETE FROM",
            "answer": "DELETE FROM tarefas;"
        }
    ]
}
